<?xml version="1.0" encoding="UTF-8"?>
<empresaDistanza xmlns:xsi="http://www.w3.org/2001/XMLSchema-instance" xsi:noNamespaceSchemaLocation="./empresa.xsd">
    <pedidos>


        <sucursal codigo_pedido="A2345679">
            <Direccion_Envio>calle algo 22 , Yecla Murcia</Direccion_Envio>
            <trabajador>Pablo</trabajador>
            <fecha_envio>2022-10-12</fecha_envio>
            <observaciones_pedido></observaciones_pedido>
            <plazo_revision></plazo_revision> 
            <articulo codigo_articulo="AAA-123">
                <unidades_vendidas>12</unidades_vendidas>
                <precio_unidad>30</precio_unidad>
                <observaciones_art></observaciones_art>
            </articulo>
        </sucursal>




    </pedidos>
    
</empresaDistanza>
